{
    "$schema": "http://json-schema.org/schema#",
    "type": "object",
    "properties": {
        "title": {
            "type": "string"
        },
        "description": {
            "type": "string"
        },
        "inputFile": {
            "type": "string"
        },
        "guid": {
            "type": "string"
        },
        "createdOn": {
            "type": "string"
        },
        "adl-PEcGpioMappingWw394": {
            "type": "array",
            "items": {
                "type": "object",
                "properties": {
                    "pinName": {
                        "type": "string"
                    },
                    "adl-PRvpNetName": {
                        "type": "string"
                    },
                    "muxConfig": {
                        "type": "string"
                    },
                    "signalDirectionWRTEc": {
                        "type": "string"
                    },
                    "defaultState": {
                        "type": "string"
                    },
                    "pushpullOpenDrain": {
                        "type": "string"
                    },
                    "interruptCapability": {
                        "type": "string"
                    }
                },
                "required": [
                    "pinName"
                ]
            }
        },
        "ecIoExpander": {
            "type": "array",
            "items": {
                "type": "object",
                "properties": {
                    "ioPins": {
                        "type": "string"
                    },
                    "function": {
                        "type": "string"
                    },
                    "direction": {
                        "type": "string"
                    }
                },
                "required": [
                    "direction",
                    "function",
                    "ioPins"
                ]
            }
        },
        "ecIoExpander2": {
            "type": "array",
            "items": {
                "type": "object",
                "properties": {
                    "ioPins": {
                        "type": "string"
                    },
                    "function": {
                        "type": "string"
                    },
                    "direction": {
                        "type": "string"
                    }
                },
                "required": [
                    "direction",
                    "function",
                    "ioPins"
                ]
            }
        }
    },
    "required": [
        "adl-PEcGpioMappingWw394",
        "createdOn",
        "description",
        "ecIoExpander",
        "ecIoExpander2",
        "guid",
        "inputFile",
        "title"
    ]
}