{
    "title": "Datasheet - sample_h_file_2",
    "description": "Describes a part",
    "inputFile": "sample_h_file_2.xlsx",
    "guid": "3a867e5b-28be-4e3f-9c6e-b4127a1c8123",
    "createdOn": "09/13/2022",
    "adl-PEcGpioMappingWw394": [
        {
            "pinName": "GPIO067/VREF2_ADC",
            "adl-PRvpNetName": "GPIO197",
            "muxConfig": "PECI",
            "signalDirectionWRTEc": "Power",
            "defaultState": "Low",
            "pushpullOpenDrain": "Open Drain",
            "interruptCapability": "BOTH"
        },
        {
            "pinName": "GPIO067/VREF2_ADC"
        },
        {
            "pinName": "GPIO067/VREF2_ADC"
        },
        {
            "pinName": "GPIO067/VREF2_ADC"
        },
        {
            "pinName": "GPIO067/VREF2_ADC"
        },
        {
            "pinName": "GPIO067/VREF2_ADC"
        },
        {
            "pinName": "GPIO067/VREF2_ADC"
        },
        {
            "pinName": "GPIO067/VREF2_ADC"
        },
        {
            "pinName": "GPIO067/VREF2_ADC"
        },
        {
            "pinName": "GPIO067/VREF2_ADC"
        },
        {
            "pinName": "GPIO067/VREF2_ADC"
        },
        {
            "pinName": "GPIO067/VREF2_ADC"
        },
        {
            "pinName": "GPIO067/VREF2_ADC"
        },
        {
            "pinName": "GPIO067/VREF2_ADC"
        },
        {
            "pinName": "GPIO067/VREF2_ADC"
        },
        {
            "pinName": "GPIO067/VREF2_ADC"
        },
        {
            "pinName": "GPIO067/VREF2_ADC"
        },
        {
            "pinName": "GPIO067/VREF2_ADC"
        },
        {
            "pinName": "GPIO067/VREF2_ADC"
        },
        {
            "pinName": "GPIO067/VREF2_ADC"
        },
        {
            "pinName": "GPIO067/VREF2_ADC"
        },
        {
            "pinName": "GPIO067/VREF2_ADC"
        },
        {
            "pinName": "GPIO067/VREF2_ADC"
        },
        {
            "pinName": "GPIO067/VREF2_ADC"
        },
        {
            "pinName": "GPIO067/VREF2_ADC"
        },
        {
            "pinName": "GPIO067/VREF2_ADC"
        },
        {
            "pinName": "GPIO067/VREF2_ADC"
        },
        {
            "pinName": "GPIO067/VREF2_ADC"
        },
        {
            "pinName": "GPIO067/VREF2_ADC"
        },
        {
            "pinName": "GPIO067/VREF2_ADC"
        },
        {
            "pinName": "GPIO067/VREF2_ADC"
        },
        {
            "pinName": "GPIO067/VREF2_ADC"
        },
        {
            "pinName": "GPIO067/VREF2_ADC"
        },
        {
            "pinName": "GPIO067/VREF2_ADC"
        },
        {
            "pinName": "GPIO067/VREF2_ADC"
        },
        {
            "pinName": "GPIO067/VREF2_ADC"
        },
        {
            "pinName": "GPIO067/VREF2_ADC"
        },
        {
            "pinName": "GPIO067/VREF2_ADC"
        },
        {
            "pinName": "GPIO067/VREF2_ADC"
        },
        {
            "pinName": "GPIO067/VREF2_ADC"
        },
        {
            "pinName": "GPIO067/VREF2_ADC"
        },
        {
            "pinName": "GPIO067/VREF2_ADC"
        },
        {
            "pinName": "GPIO067/VREF2_ADC"
        },
        {
            "pinName": "GPIO067/VREF2_ADC"
        },
        {
            "pinName": "GPIO067/VREF2_ADC"
        },
        {
            "pinName": "GPIO067/VREF2_ADC"
        },
        {
            "pinName": "GPIO067/VREF2_ADC"
        },
        {
            "pinName": "GPIO067/VREF2_ADC"
        },
        {
            "pinName": "GPIO067/VREF2_ADC"
        },
        {
            "pinName": "GPIO067/VREF2_ADC"
        },
        {
            "pinName": "GPIO067/VREF2_ADC"
        },
        {
            "pinName": "GPIO067/VREF2_ADC"
        },
        {
            "pinName": "GPIO067/VREF2_ADC"
        },
        {
            "pinName": "GPIO067/VREF2_ADC"
        },
        {
            "pinName": "GPIO067/VREF2_ADC"
        },
        {
            "pinName": "GPIO067/VREF2_ADC"
        },
        {
            "pinName": "GPIO067/VREF2_ADC"
        },
        {
            "pinName": "GPIO067/VREF2_ADC"
        },
        {
            "pinName": "GPIO067/VREF2_ADC"
        },
        {
            "pinName": "GPIO067/VREF2_ADC"
        },
        {
            "pinName": "GPIO067/VREF2_ADC"
        },
        {
            "pinName": "GPIO067/VREF2_ADC"
        },
        {
            "pinName": "GPIO067/VREF2_ADC"
        },
        {
            "pinName": "GPIO067/VREF2_ADC"
        },
        {
            "pinName": "GPIO067/VREF2_ADC"
        },
        {
            "pinName": "GPIO067/VREF2_ADC"
        },
        {
            "pinName": "GPIO067/VREF2_ADC"
        },
        {
            "pinName": "GPIO067/VREF2_ADC"
        },
        {
            "pinName": "GPIO067/VREF2_ADC"
        },
        {
            "pinName": "GPIO067/VREF2_ADC"
        },
        {
            "pinName": "GPIO067/VREF2_ADC"
        },
        {
            "pinName": "GPIO067/VREF2_ADC"
        },
        {
            "pinName": "GPIO067/VREF2_ADC"
        },
        {
            "pinName": "GPIO067/VREF2_ADC"
        },
        {
            "pinName": "GPIO067/VREF2_ADC"
        },
        {
            "pinName": "GPIO067/VREF2_ADC"
        },
        {
            "pinName": "GPIO067/VREF2_ADC"
        },
        {
            "pinName": "GPIO067/VREF2_ADC"
        },
        {
            "pinName": "GPIO067/VREF2_ADC"
        },
        {
            "pinName": "GPIO067/VREF2_ADC"
        },
        {
            "pinName": "GPIO067/VREF2_ADC"
        },
        {
            "pinName": "GPIO067/VREF2_ADC"
        },
        {
            "pinName": "GPIO067/VREF2_ADC"
        },
        {
            "pinName": "GPIO067/VREF2_ADC"
        },
        {
            "pinName": "GPIO067/VREF2_ADC"
        },
        {
            "pinName": "GPIO067/VREF2_ADC"
        },
        {
            "pinName": "GPIO067/VREF2_ADC"
        },
        {
            "pinName": "GPIO067/VREF2_ADC"
        },
        {
            "pinName": "GPIO067/VREF2_ADC"
        },
        {
            "pinName": "GPIO067/VREF2_ADC"
        },
        {
            "pinName": "GPIO067/VREF2_ADC"
        },
        {
            "pinName": "GPIO067/VREF2_ADC"
        },
        {
            "pinName": "GPIO067/VREF2_ADC"
        },
        {
            "pinName": "GPIO067/VREF2_ADC"
        },
        {
            "pinName": "GPIO067/VREF2_ADC"
        },
        {
            "pinName": "GPIO067/VREF2_ADC"
        },
        {
            "pinName": "GPIO067/VREF2_ADC"
        },
        {
            "pinName": "GPIO067/VREF2_ADC"
        },
        {
            "pinName": "GPIO067/VREF2_ADC"
        },
        {
            "pinName": "GPIO067/VREF2_ADC"
        },
        {
            "pinName": "GPIO067/VREF2_ADC"
        },
        {
            "pinName": "GPIO067/VREF2_ADC"
        },
        {
            "pinName": "GPIO067/VREF2_ADC"
        },
        {
            "pinName": "GPIO067/VREF2_ADC"
        },
        {
            "pinName": "GPIO067/VREF2_ADC"
        },
        {
            "pinName": "GPIO067/VREF2_ADC"
        },
        {
            "pinName": "GPIO067/VREF2_ADC"
        },
        {
            "pinName": "GPIO067/VREF2_ADC"
        },
        {
            "pinName": "GPIO067/VREF2_ADC"
        },
        {
            "pinName": "GPIO067/VREF2_ADC"
        },
        {
            "pinName": "GPIO067/VREF2_ADC"
        },
        {
            "pinName": "GPIO067/VREF2_ADC"
        },
        {
            "pinName": "GPIO067/VREF2_ADC"
        },
        {
            "pinName": "GPIO067/VREF2_ADC"
        },
        {
            "pinName": "GPIO067/VREF2_ADC"
        },
        {
            "pinName": "GPIO067/VREF2_ADC"
        },
        {
            "pinName": "GPIO067/VREF2_ADC"
        },
        {
            "pinName": "GPIO067/VREF2_ADC"
        },
        {
            "pinName": "GPIO067/VREF2_ADC"
        },
        {
            "pinName": "GPIO067/VREF2_ADC"
        },
        {
            "pinName": "GPIO067/VREF2_ADC"
        },
        {
            "pinName": "GPIO067/VREF2_ADC"
        },
        {
            "pinName": "GPIO067/VREF2_ADC"
        },
        {
            "pinName": "GPIO067/VREF2_ADC"
        },
        {
            "pinName": "GPIO067/VREF2_ADC"
        },
        {
            "pinName": "GPIO067/VREF2_ADC"
        },
        {
            "pinName": "GPIO067/VREF2_ADC"
        },
        {
            "pinName": "GPIO067/VREF2_ADC"
        },
        {
            "pinName": "GPIO067/VREF2_ADC"
        },
        {
            "pinName": "GPIO067/VREF2_ADC"
        },
        {
            "pinName": "GPIO067/VREF2_ADC"
        },
        {
            "pinName": "GPIO067/VREF2_ADC"
        },
        {
            "pinName": "GPIO067/VREF2_ADC"
        },
        {
            "pinName": "GPIO067/VREF2_ADC"
        },
        {
            "pinName": "GPIO067/VREF2_ADC"
        },
        {
            "pinName": "GPIO067/VREF2_ADC"
        },
        {
            "pinName": "GPIO067/VREF2_ADC"
        },
        {
            "pinName": "GPIO067/VREF2_ADC"
        },
        {
            "pinName": "GPIO067/VREF2_ADC"
        },
        {
            "pinName": "GPIO067/VREF2_ADC"
        },
        {
            "pinName": "GPIO067/VREF2_ADC"
        },
        {
            "pinName": "GPIO067/VREF2_ADC"
        },
        {
            "pinName": "GPIO067/VREF2_ADC"
        },
        {
            "pinName": "GPIO067/VREF2_ADC"
        },
        {
            "pinName": "GPIO067/VREF2_ADC"
        },
        {
            "pinName": "GPIO067/VREF2_ADC"
        },
        {
            "pinName": "GPIO067/VREF2_ADC"
        },
        {
            "pinName": "GPIO067/VREF2_ADC"
        }
    ],
    "ecIoExpander": [
        {